{
  "dataset": "laws",
  "schema_version": "1.0",
  "last_updated": "2026-10-17",
  "maintainer": "Member 2 - Legal Research & Verified Support Database",
  "disclaimer": "Legal information for awareness, not legal advice. Summaries are paraphrased; the official Gazette text prevails. Check each entry's verification block before citing it.",
  "levels": {
    "A": "Official full text was read; every key_provision below was checked against that text.",
    "B": "The law is confirmed by an official source (government listing or PDF, court judgment, official department page, UN/state media). Only the key_provisions listed are verified - do not describe anything else from this law.",
    "C": "Secondary sources only. Kept for research, never shown to users."
  },
  "laws": [
    {
      "id": "sindh-standing-orders-2015",
      "title": "Sindh Terms of Employment (Standing Orders) Act, 2015",
      "short_name": "Standing Orders Act",
      "act_number": "Sindh Act No. XI of 2016",
      "jurisdiction": "sindh",
      "categories": ["employment"],
      "dates": {"passed": "2016-03-21", "assented": "2016-04-25", "published": "2016-04-29"},
      "official_text_url": "https://lhr.sindh.gov.pk/storage/rulesRegulations/6jLG9Ha7bNMwJgKNpGyxfmIVa4YzXmeLAvV60TXW.pdf",
      "other_official_urls": ["https://www.sindhlaws.gov.pk/Setup/Publications_SindhCode/PUB-NEW-18-000108.pdf"],
      "replaces": "Industrial and Commercial Employment (Standing Orders) Ordinance, 1968, in its application to Sindh (s.14).",
      "scope": "Industrial and commercial establishments in Sindh employing 10 or more workers (now, or on any day in the previous 12 months), plus classes notified by Government. Not applicable where government statutory service rules apply. Some Standing Orders (e.g. SO 13 bonus, SO 15 closure) do not initially apply to industrial establishments with 20 or fewer persons.",
      "amendments": [
        {
          "title": "Sindh Terms of Employment (Standing Orders) (Amendment) Act, 2021",
          "act_number": "Sindh Act No. XXVIII of 2021",
          "dates": {"passed": "2021-07-02", "assented": "2021-07-28", "published": "2021-08-04"},
          "url": "https://www.sindhlaws.gov.pk/setup/publications_SindhCode/PUB-NEW-23-000058.pdf",
          "reviewed": true,
          "summary": "Adds 'seasonal worker' as a class with a seasonal card (SO 1(a)(vii), SO 1(h), SO 2(7)); removes the old proviso in SO 16(6) that gave seasonal workers one month's gratuity per season; inserts SO 20-A (extra month's wages at the end of a season)."
        }
      ],
      "key_provisions": [
        {"ref": "s.1(4)", "point": "Applies to industrial and commercial establishments with 10 or more workers.", "source": 0},
        {"ref": "s.2(1)(n)", "point": "'Worker' includes permanent, probationer, badli, temporary, apprentice and contract workers, but not an occupier or manager who has hiring and firing authority.", "source": 0},
        {"ref": "s.5", "point": "The employer must display the Act in English, Urdu and Sindhi (and in the language of the majority of workers) near the entrance and in all departments.", "source": 0},
        {"ref": "s.7", "point": "Contravening the Standing Orders is punishable with fines; prosecutions are brought by the Inspector and tried by the Labour Court.", "source": 0},
        {"ref": "s.11", "point": "No discrimination on the basis of gender, religion, political affiliation, sect, colour, caste, creed or ethnic background in enforcing the Act.", "source": 0},
        {"ref": "SO 1", "point": "Classes of worker: permanent, probationer, badli, temporary, apprentice, contract worker (seasonal worker added in 2021). Probation is 3 months; a worker engaged on work likely to last more than 9 months becomes permanent after satisfactorily completing 3 months' probation. Temporary work is work likely to finish within 9 months.", "source": 0},
        {"ref": "SO 3", "point": "Every worker must be given an appointment letter at the time of appointment stating the terms and conditions of employment, including wages. Transfers and promotions must also be given in writing.", "source": 0},
        {"ref": "SO 9", "point": "Paid holidays and leave apply as provided by law; all festival holidays declared by Government are paid. A leave application must be decided within a week, and a refusal must be recorded in writing with reasons.", "source": 0},
        {"ref": "SO 10(2)", "point": "Wages must be paid before the 7th day after the wage period ends (establishments with up to 1,000 workers) or before the 10th day (more than 1,000 workers).", "source": 0},
        {"ref": "SO 10(3)", "point": "In commercial establishments, work beyond 9 hours a day or 48 hours a week must be paid at twice the normal wage rate.", "source": 0},
        {"ref": "SO 12", "point": "Establishments with 20 or more workers must insure all permanent workers (group insurance) against natural death, disability, and death or injury not covered by workmen's compensation or social security law; if the employer fails, the employer pays the equivalent amount.", "source": 0},
        {"ref": "SO 14(3)", "point": "Workers laid off because of plant failure, curtailment of production or similar causes get half their daily wages as compensation for the first 14 days of lay-off.", "source": 0},
        {"ref": "SO 15", "point": "An employer may not terminate more than 50% of the workers or close the whole establishment without prior Government permission (except for fire, catastrophe, power stoppage, epidemic or civil commotion).", "source": 0},
        {"ref": "SO 16(1)", "point": "Terminating a permanent worker for any reason other than misconduct requires one month's notice, or one month's wages (average of the last 3 months) in lieu. The same one-month notice applies when a permanent worker leaves.", "source": 0},
        {"ref": "SO 16(2)", "point": "Temporary workers, probationers, badlis and contract workers are not entitled to notice of termination (and need not give notice when leaving).", "source": 0},
        {"ref": "SO 16(3)", "point": "No worker may be terminated, removed, retrenched, discharged or dismissed except by a written order that explicitly states the reason. An aggrieved worker can use the individual grievance procedure of the Sindh Industrial Relations Act, 2013.", "source": 0, "note": "The Standing Order cross-refers to 'section 37' of the Sindh Industrial Relations Act, 2013; the grievance section of that Act is s.34, and High Court of Sindh judgments apply s.34 together with SO 16(3)."},
        {"ref": "SO 16(4)", "point": "On termination, earned wages and other dues (including payment for unavailed leave) must be paid before the end of the second working day.", "source": 0},
        {"ref": "SO 16(6)", "point": "On resignation, or on termination for any reason other than misconduct, the worker gets gratuity of one month's wages for every completed year of service (or part of a year above 6 months) - unless, for that period, the employer ran a provident fund with an employer contribution at least equal to the worker's (and the provident fund amount is not less than the gratuity).", "source": 0, "note": "Wording as amended by Sindh Act No. XXVIII of 2021 (seasonal-worker proviso removed)."},
        {"ref": "SO 16(7)", "point": "A worker is entitled to the full provident fund balance, including the employer's contributions, even after resigning or being dismissed.", "source": 0},
        {"ref": "SO 16(10)", "point": "If a worker is not allowed to work or to mark attendance, the worker may report this in writing to the area Inspector within 10 days; the employer is then barred from initiating action against the worker.", "source": 0},
        {"ref": "SO 17", "point": "A permanent worker is entitled to a service certificate when the employment ends for any reason.", "source": 0},
        {"ref": "SO 18-19", "point": "Retrenchment within a category is last-come, first-go; retrenched workers get preference if the employer hires again within one year.", "source": 0},
        {"ref": "SO 20-A", "point": "A seasonal worker who worked throughout the season (at least 75% of its days) gets one extra month's wages at the end of the season.", "source": 1},
        {"ref": "SO 21(3)", "point": "Misconduct includes wilful insubordination, theft, fraud or dishonesty, wilful damage, bribery, habitual absence or absence without leave for more than 10 days, habitual late attendance, riotous behaviour, habitual negligence, illegal strike and go-slow.", "source": 0},
        {"ref": "SO 21(4)", "point": "No dismissal for misconduct unless the worker is informed in writing of the alleged misconduct within one month and given a chance to explain; an independent inquiry is required and the worker may nominate a co-worker to assist.", "source": 0},
        {"ref": "SO 21(5)", "point": "Suspension pending inquiry may not exceed one week at a time or four weeks in total (with limited exceptions), and full wages are payable during suspension.", "source": 0},
        {"ref": "SO 22", "point": "A worker occupying employer-provided housing must vacate it within 2 months after the employment ends; after that the employer may seek summary eviction from a First Class Magistrate.", "source": 0}
      ],
      "keywords": ["appointment letter", "naukri se nikal diya", "nokri khatam", "termination", "notice period", "ek mahine ka notice", "gratuity", "bonus", "probation", "permanent worker", "kachi naukri", "contract worker", "temporary worker", "misconduct", "inquiry", "suspension", "service certificate", "retrenchment", "layoff", "overtime", "company quarter"],
      "caveats": [
        "Applies only where 10 or more workers are employed - confirm the size of the establishment first.",